[
  {
    "id": "scout-sentinels",
    "name": "Scout Sentinels",
    "faction_id": "astra-militarum",
    "profiles": [
      {
        "name": "Scout Sentinels",
        "M": 10,
        "T": 7,
        "W": 7,
        "Sv": 3,
        "invuln_sv": null,
        "Ld": 7,
        "OC": 2
      }
    ],
    "points": [
      {
        "models": 1,
        "cost": 55
      },
      {
        "models": 2,
        "cost": 100
      }
    ],
    "keywords": [
      "Vehicle",
      "Walker",
      "Smoke",
      "Imperium",
      "Regiment",
      "Squadron",
      "Scout Sentinels"
    ],
    "faction_keywords": [
      "Astra Militarum"
    ],
    "base_size_mm": {
      "shape": "round",
      "diameter": 80
    },
    "model_count": {
      "min": 1,
      "max": 2
    },
    "weapon_ids": [
      "autocannon",
      "close-combat-weapon",
      "heavy-flamer",
      "hunter-killer-missile",
      "lascannon",
      "missile-launcher",
      "multi-laser",
      "plasma-cannon",
      "sentinel-chainsaw"
    ],
    "ability_ids": [
      "daring-recon",
      "deadly-demise-1",
      "scouts-9"
    ],
    "game_version": {
      "edition": "11th",
      "dataslate": "launch"
    },
    "is_legend": false,
    "points_provisional": false
  },
  {
    "id": "cadian-castellan",
    "name": "Cadian Castellan",
    "faction_id": "astra-militarum",
    "role": "character",
    "profiles": [
      {
        "name": "Cadian Castellan",
        "M": 6,
        "T": 3,
        "W": 4,
        "Sv": 5,
        "invuln_sv": 5,
        "Ld": 7,
        "OC": 1
      }
    ],
    "points": [
      {
        "models": 1,
        "cost": 55
      }
    ],
    "keywords": [
      "Infantry",
      "Character",
      "Grenades",
      "Imperium",
      "Officer",
      "Cadian Castellan"
    ],
    "faction_keywords": [
      "Astra Militarum"
    ],
    "base_size_mm": {
      "shape": "round",
      "diameter": 28.5
    },
    "model_count": {
      "min": 1,
      "max": 1
    },
    "weapon_ids": [
      "bolt-pistol",
      "boltgun",
      "chainsword",
      "close-combat-weapon-cadian-castellan",
      "laspistol",
      "plasma-pistol",
      "power-fist",
      "power-weapon"
    ],
    "ability_ids": [
      "get-back-in-the-fight",
      "leader",
      "orders",
      "senior-officer"
    ],
    "game_version": {
      "edition": "11th",
      "dataslate": "launch"
    },
    "is_legend": false,
    "points_provisional": false,
    "attachment_role": "leader"
  },
  {
    "id": "gaunts-ghosts",
    "name": "Gaunt’s Ghosts",
    "faction_id": "astra-militarum",
    "role": "epic-hero",
    "profiles": [
      {
        "name": "Ibram Gaunt",
        "M": 6,
        "T": 3,
        "W": 3,
        "Sv": 4,
        "invuln_sv": 5,
        "Ld": 6,
        "OC": 1
      },
      {
        "name": "Oan Mkoll",
        "M": 6,
        "T": 3,
        "W": 2,
        "Sv": 5,
        "invuln_sv": 5,
        "Ld": 7,
        "OC": 1
      }
    ],
    "points": [
      {
        "models": 6,
        "cost": 95
      }
    ],
    "keywords": [
      "Infantry",
      "Grenades",
      "Imperium",
      "Gaunt’s Ghosts",
      "Character",
      "Epic Hero",
      "Officer"
    ],
    "faction_keywords": [
      "Astra Militarum"
    ],
    "base_size_mm": {
      "shape": "round",
      "diameter": 28.5
    },
    "model_count": {
      "min": 6,
      "max": 6
    },
    "weapon_ids": [
      "bolt-pistol-gaunts-ghosts",
      "braggs-autocannon",
      "corbecs-hot-shot-lascarbine",
      "gaunts-chainsword",
      "larkins-long-las",
      "lascarbine",
      "mkolls-straight-silver-knife",
      "rawnes-lascarbine",
      "straight-silver-knife"
    ],
    "ability_ids": [
      "covert-stealth-team",
      "fights-first",
      "infiltrators",
      "lone-operative",
      "orders",
      "stealth",
      "tanith-camo-cloaks",
      "voice-of-command"
    ],
    "game_version": {
      "edition": "11th",
      "dataslate": "launch"
    },
    "is_legend": false,
    "points_provisional": false
  },
  {
    "id": "nork-deddog",
    "name": "Nork Deddog",
    "faction_id": "astra-militarum",
    "role": "epic-hero",
    "profiles": [
      {
        "name": "Nork Deddog",
        "M": 6,
        "T": 6,
        "W": 6,
        "Sv": 4,
        "invuln_sv": null,
        "Ld": 7,
        "OC": 1
      }
    ],
    "points": [
      {
        "models": 1,
        "cost": 60
      }
    ],
    "keywords": [
      "Infantry",
      "Character",
      "Epic Hero",
      "Grenades",
      "Imperium",
      "Loyal Protector",
      "Ogryn",
      "Nork Deddog"
    ],
    "faction_keywords": [
      "Astra Militarum"
    ],
    "base_size_mm": {
      "shape": "round",
      "diameter": 40
    },
    "model_count": {
      "min": 1,
      "max": 1
    },
    "weapon_ids": [
      "huge-knife",
      "ripper-gun"
    ],
    "ability_ids": [
      "feel-no-pain-5",
      "loyal-protector",
      "ogryn-bodyguard",
      "thunderous-head-butt"
    ],
    "game_version": {
      "edition": "11th",
      "dataslate": "launch"
    },
    "is_legend": false,
    "points_provisional": false
  },
  {
    "id": "cadian-shock-troops",
    "name": "Cadian Shock Troops",
    "faction_id": "astra-militarum",
    "role": "battleline",
    "profiles": [
      {
        "name": "Shock Trooper",
        "M": 6,
        "T": 3,
        "W": 1,
        "Sv": 5,
        "invuln_sv": null,
        "Ld": 7,
        "OC": 2
      }
    ],
    "points": [
      {
        "models": 10,
        "cost": 75
      },
      {
        "models": 20,
        "cost": 145
      }
    ],
    "keywords": [
      "Infantry",
      "Battleline",
      "Imperium",
      "Grenades",
      "Regiment",
      "Platoon",
      "Cadian Shock Troops"
    ],
    "faction_keywords": [
      "Astra Militarum"
    ],
    "base_size_mm": {
      "shape": "round",
      "diameter": 25
    },
    "model_count": {
      "min": 10,
      "max": 20
    },
    "weapon_ids": [
      "bolt-pistol-cadian-shock-troops",
      "chainsword-cadian-shock-troops",
      "close-combat-weapon-cadian-shock-troops",
      "flamer",
      "grenade-launcher",
      "lasgun",
      "laspistol-cadian-shock-troops",
      "meltagun",
      "plasma-gun",
      "sergeants-autogun"
    ],
    "ability_ids": [
      "shock-troops",
      "vox-caster"
    ],
    "game_version": {
      "edition": "11th",
      "dataslate": "launch"
    },
    "is_legend": false,
    "points_provisional": false,
    "wargear_budgets": [
      {
        "items": [
          "flamer",
          "grenade-launcher",
          "meltagun",
          "plasma-gun"
        ],
        "count": 2,
        "per_models": 10,
        "duplicate_limit": 1
      },
      {
        "items": [
          "vox-caster"
        ],
        "count": 1,
        "per_models": 0
      }
    ]
  },
  {
    "id": "militarum-tempestus-command-squad",
    "name": "Militarum Tempestus Command Squad",
    "faction_id": "astra-militarum",
    "role": "character",
    "profiles": [
      {
        "name": "Tempestus Scion",
        "M": 6,
        "T": 3,
        "W": 1,
        "Sv": 4,
        "invuln_sv": null,
        "Ld": 7,
        "OC": 1
      },
      {
        "name": "Tempestor Prime",
        "M": 6,
        "T": 3,
        "W": 3,
        "Sv": 4,
        "invuln_sv": null,
        "Ld": 7,
        "OC": 1
      }
    ],
    "points": [
      {
        "models": 5,
        "cost": 85,
        "unit_count_min": 1,
        "unit_count_max": 1
      },
      {
        "models": 5,
        "cost": 95,
        "unit_count_min": 2,
        "unit_count_max": null
      }
    ],
    "keywords": [
      "Infantry",
      "Grenades",
      "Imperium",
      "Militarum Tempestus",
      "Command Squad",
      "Character",
      "Officer"
    ],
    "faction_keywords": [
      "Astra Militarum"
    ],
    "base_size_mm": {
      "shape": "round",
      "diameter": 25
    },
    "model_count": {
      "min": 5,
      "max": 5
    },
    "weapon_ids": [
      "bolt-pistol",
      "close-combat-weapon-militarum-tempestus-command-squad",
      "flamer",
      "grenade-launcher-militarum-tempestus-command-squad",
      "hot-shot-lasgun",
      "hot-shot-laspistol",
      "hot-shot-volley-gun",
      "meltagun-militarum-tempestus-command-squad",
      "plasma-gun-militarum-tempestus-command-squad",
      "plasma-pistol",
      "tempestus-dagger"
    ],
    "ability_ids": [
      "command-rod",
      "deep-strike",
      "leader",
      "master-vox",
      "medi-pack",
      "regimental-standard",
      "tempestor-prime"
    ],
    "game_version": {
      "edition": "11th",
      "dataslate": "launch"
    },
    "is_legend": false,
    "points_provisional": false,
    "attachment_role": "leader",
    "wargear_budgets": [
      {
        "items": [
          "grenade-launcher-militarum-tempestus-command-squad"
        ],
        "count": 1,
        "per_models": 0
      },
      {
        "items": [
          "flamer"
        ],
        "count": 1,
        "per_models": 0
      },
      {
        "items": [
          "master-vox"
        ],
        "count": 1,
        "per_models": 0
      },
      {
        "items": [
          "plasma-gun-militarum-tempestus-command-squad"
        ],
        "count": 1,
        "per_models": 0
      },
      {
        "items": [
          "meltagun-militarum-tempestus-command-squad"
        ],
        "count": 1,
        "per_models": 0
      },
      {
        "items": [
          "regimental-standard"
        ],
        "count": 1,
        "per_models": 0
      },
      {
        "items": [
          "hot-shot-volley-gun"
        ],
        "count": 1,
        "per_models": 0
      }
    ]
  },
  {
    "id": "lord-solar-leontus",
    "name": "Lord Solar Leontus",
    "faction_id": "astra-militarum",
    "role": "epic-hero",
    "profiles": [
      {
        "name": "Lord Solar Leontus",
        "M": 12,
        "T": 4,